,emotion,quotes
351,religion,"About once or twice every month I engage in public debates with those whose pressing need it is to woo and to win the approval of supernatural beings. Very often, when I give my view that there is no supernatural dimension, and certainly not one that is only or especially available to the faithful, and that the natural world is wonderful enough—and even miraculous enough if you insist—I attract pitying looks and anxious questions. How, in that case, I am asked, do I find meaning and purpose in life? How does a mere and gross materialist, with no expectation of a life to come, decide what, if anything, is worth caring about?Depending on my mood, I sometimes but not always refrain from pointing out what a breathtakingly insulting and patronizing question this is. (It is on a par with the equally subtle inquiry: Since you don't believe in our god, what stops you from stealing and lying and raping and killing to your heart's content?) Just as the answer to the latter question is: self-respect and the desire for the respect of others—while in the meantime it is precisely those who think they have divine permission who are truly capable of any atrocity—so the answer to the first question falls into two parts. A life that partakes even a little of friendship, love, irony, humor, parenthood, literature, and music, and the chance to take part in battles for the liberation of others cannot be called 'meaningless' except if the person living it is also an existentialist and elects to call it so. It could be that all existence is a pointless joke, but it is not in fact possible to live one's everyday life as if this were so. Whereas if one sought to define meaninglessness and futility, the idea that a human life should be expended in the guilty, fearful, self-obsessed propitiation of supernatural nonentities… but there, there. Enough."
352,religion,Sometimes you can see things happen right in front of your eyes and still jump to the wrong conclusions.
353,religion,Conventionality is not morality. Self-righteousness is not religion. To attack the first is not to assail the last.
354,religion,"Gradually it was disclosed to me that the line separating good and evil passes not through states, nor between classes, nor between political parties either -- but right through every human heart -- and through all human hearts. This line shifts. Inside us, it oscillates with the years. And even within hearts overwhelmed by evil, one small bridgehead of good is retained. And even in the best of all hearts, there remains ... an unuprooted small corner of evil. Since then I have come to understand the truth of all the religions of the world: They struggle with the evil inside a human being (inside every human being). It is impossible to expel evil from the world in its entirety, but it is possible to constrict it within each person."
355,religion,"Just because I do not accept the teachings of the devotaries does not mean I've discarded a belief in right and wrong.""""But the Almighty determines what is right!""""Must someone, some unseen thing, declare what is right for it to be right? I believe that my own morality -- which answers only to my heart -- is more sure and true than the morality of those who do right only because they fear retribution."
356,religion,"Your question is the most difficult in the world. It is not a question I can answer simply with yes or no. I am not an Atheist. I do not know if I can define myself as a Pantheist. The problem involved is too vast for our limited minds. May I not reply with a parable? The human mind, no matter how highly trained, cannot grasp the universe. We are in the position of a little child, entering a huge library whose walls are covered to the ceiling with books in many different tongues. The child knows that someone must have written those books. It does not know who or how. It does not understand the languages in which they are written. The child notes a definite plan in the arrangement of the books, a mysterious order, which it does not comprehend, but only dimly suspects. That, it seems to me, is the attitude of the human mind, even the greatest and most cultured, toward God. We see a universe marvelously arranged, obeying certain laws, but we understand the laws only dimly. Our limited minds cannot grasp the mysterious force that sways the constellations. I am fascinated by Spinoza's Pantheism. I admire even more his contributions to modern thought. Spinoza is the greatest of modern philosophers, because he is the first philosopher who deals with the soul and the body as one, not as two separate things."
357,religion,"Perhaps not one religion contains all of the truth of the world. Perhaps every religion contains fragments of the truth, and it is our responsibility to identify those fragments and piece them together."
358,religion,"Many religions now come before us with ingratiating smirks and outspread hands, like an unctuous merchant in a bazaar. They offer consolation and solidarity and uplift, competing as they do in a marketplace. But we have a right to remember how barbarically they behaved when they were strong and were making an offer that people could not refuse."
359,religion,Doubt isn't the opposite of faith; it is an element of faith.
360,religion,"If Jesus came back and saw what was being done in his name, he'd never stop throwing up."
361,religion,"It is truth that liberates, not your effort to be free."
362,religion,"If you think God’s there, He is. If you don’t, He isn’t. And if that’s what God’s like, I wouldn’t worry about it."
363,religion,"The more I learn about the universe, the less convinced I am that there's any sort of benevolent force that has anything to do with it, at all."
364,religion,Music is my higher power
365,religion,"Night poured over the desert. It came suddenly, in purple. In the clear air, the stars drilled down out of the sky, reminding any thoughtful watcher that it is in the deserts and high places that religions are generated. When men see nothing but bottomless infinity over their heads they have always had a driving and desperate urge to find someone to put in the way."
366,religion,"Where the mind is without fear and the head is held high;Where knowledge is free;Where the world has not been broken up into fragments by narrow domestic walls;Where words come out from the depth of truth;Where tireless striving stretches its arms toward perfection;Where the clear stream of reason has not lost its way into the dreary desert sand of dead habit;Where the mind is led forward by thee into ever-widening thought and action -Into that heaven of freedom, my Father, let my country awake."
367,religion,What has he found who has lost God?And what has he lost who has found God?
368,religion,"I did not marry the first girl that I fell in love with, because there was a tremendous religious conflict, at the time. She was an atheist, and I was an agnostic."
369,religion,Photons have mass? I didn’t even know they were Catholic.
370,religion,"The real question of life after death isn't whether or not it exists, but even if it does what problem this really solves."
371,religion,God doesn’t need to punish us. He just grants us a long enough life to punish ourselves.
372,religion,"If there's only one nation in the sky, shouldn't all passports be valid for it?"
373,religion,I’m an atheist and I thank God for it.
374,religion,"...legitimate powers of government reach actions only, & not opinions, I contemplate with sovereign reverence that act of the whole American people which declared that their legislature should 'make no law respecting an establishment of religion, or prohibiting the free exercise thereof,' thus building a wall of separation between Church & State. Adhering to this expression of the supreme will of the nation in behalf of the rights of conscience, I shall see with sincere satisfaction the progress of those sentiments which tend to restore to man all his natural rights, convinced he has no natural right in opposition to his social duties."
375,religion,Civilization will not attain to its perfection until the last stone from the last church falls on the last priest.
376,religion,We have a choice. We have two options as human beings. We have a choice between conversation and war. That's it. Conversation and violence. And faith is a conversation stopper.
377,religion,I call him religious who understands the suffering of others.
378,religion,A young man who wishes to remain a sound atheist cannot be too careful of his reading.
379,religion,"Gods prefer simple, vicious games, where you Do Not Achieve Transcendence but Go Straight To Oblivion; a key to the understanding of all religion is that a god's idea of amusement is Snakes and Ladders with greased rungs."
380,religion,"The word 'God' is for me nothing more than the expression and product of human weaknesses, the Bible a collection of honorable, but still primitive legends which are nevertheless pretty childish. No interpretation, no matter how subtle, can (for me) change this."
381,religion,"I consider it an extremely dangerous doctrine, because the more likely we are to assume that the solution comes from the outside, the less likely we are to solve our problems ourselves."
382,religion,"In every age it has been the tyrant, the oppressor and the exploiter who has wrapped himself in the cloak of patriotism, or religion, or both to deceive and overawe the People."
383,religion,"Hindus, in their capacity for love, are indeed hairless Christians, just as Muslims, in the way they see God in everything, are bearded Hindus, and Christians, in their devotion to God, are hat wearing Muslims."
384,religion,"Governments want efficient technicians, not human beings, because human beings become dangerous to governments – and to organized religions as well. That is why governments and religious organizations seek to control education."
385,religion,All religions are true but none are literal.
386,religion,"Generally speaking, the errors in religion are dangerous; those in philosophy only ridiculous."
387,religion,Aim at Heaven and you will get Earth 'thrown in': aim at Earth and you will get neither.
388,religion,"All religions, arts and sciences are branches of the same tree. All these aspirations are directed toward ennobling man's life, lifting it from the sphere of mere physical existence and leading the individual towards freedom."
389,religion,"Words do not express thoughts very well; every thing immediately becomes a little different, a little distorted, a little foolish. And yet it also pleases me and seems right that what is of value and wisdom of one man seems nonsense to another."
390,religion,I have as much authority as the Pope. I just don’t have as many people who believe it.
391,religion,The most confused you will ever get is when you try to convince your heart and spirit of something your mind knows is a lie.
392,religion,"I suppose that one reason I have always detested religion is its sly tendency to insinuate the idea that the universe is designed with 'you' in mind or, even worse, that there is a divine plan into which one fits whether one knows it or not. This kind of modesty is too arrogant for me."
393,religion,I have so much to do that I shall spend the first three hours in prayer.
394,religion,"I assess the power of a will by how much resistance, pain, torture it endures and knows how to turn to its advantage"
395,religion,"Almost any sect, cult, or religion will legislate its creed into law if it acquires the political power to do so."
396,religion,I would never want to be a member of a group whose symbol was a man nailed to two pieces of wood.
397,religion,"There are random moments - tossing a salad, coming up the driveway to the house, ironing the seams flat on a quilt square, standing at the kitchen window and looking out at the delphiniums, hearing a burst of laughter from one of my children's rooms - when I feel a wavelike rush of joy. This is my true religion: arbitrary moments of of nearly painful happiness for a life I feel privileged to lead."
398,religion,Do not abandon yourselves to despair. We are the Easter people and hallelujah is our song.
399,religion,I believe in the fundamental truth of all great religions of the world.
400,religion,"Tradition means giving votes to the most obscure of all classes, our ancestors. It is the democracy of the dead. Tradition refuses to submit to the small and arrogant oligarchy of those who merely happen to be walking about."
401,religion,"Half the people in the world think that the metaphors of their religious traditions, for example, are facts. And the other half contends that they are not facts at all. As a result we have people who consider themselves believers because they accept metaphors as facts, and we have others who classify themselves as atheists because they think religious metaphors are lies."
402,religion,"Conventionality is not morality. Self-righteousness is not religion. To attack the first is not to assail the last. To pluck the mask from the face of the Pharisee, is not to lift an impious hand to the Crown of Thorns.These things and deeds are diametrically opposed: they are as distinct as is vice from virtue. Men too often confound them: they should not be confounded: appearance should not be mistaken for truth; narrow human doctrines, that only tend to elate and magnify a few, should not be substituted for the world-redeeming creed of Christ. There is – I repeat it – a difference; and it is a good, and not a bad action to mark broadly and clearly the line of separation between them."
403,religion,"To be fair, much of the Bible is not systematically evil but just plain weird, as you would expect of a chaotically cobbled-together anthology of disjointed documents, composed, revised, translated, distorted and 'improved' by hundreds of anonymous authors, editors and copyists, unknown to us and mostly unknown to each other, spanning nine centuries"
404,religion,"Oh, Adam’s sons, how cleverly you defend yourselves against all that might do you good!"
405,religion,"Religion isn't the cause of wars, it's the excuse."
406,religion,The minute you get a religion you stop thinking. Believe in one thing too much and you have no room for new ideas.
407,religion,We should live our lives as though Christ was coming this afternoon.
408,religion,"To live by grace means to acknowledge my whole life story, the light side and the dark. In admitting my shadow side I learn who I am and what God's grace means."
409,religion,"I have found God, but he is insufficient."
410,religion,"I think the reason we sometimes have the false sense that God is so far away is because that is where we have put him. We have kept him at a distance, and then when we are in need and call on him in prayer, we wonder where he is. He is exactly where we left him."
411,religion,"The fact that a believer is happier than a skeptic is no more to the point than the fact that a drunken man is happier than a sober one. The happiness of credulity is a cheap and dangerous quality of happiness, and by no means a necessity of life."
412,religion,"I came to the conclusion long ago that all religions were true and that also that all had some error in them, and while I hold by my own religion, I should hold other religions as dear as Hinduism. So we can only pray, if we were Hindus, not that a Christian should become a Hindu; but our innermost prayer should be that a Hindu should become a better Hindu, a Muslim a better Muslim, and a Christian a better Christian."
413,religion,"When we blindly adopt a religion, a political system, a literary dogma, we become automatons."
414,religion,"Religion is still useful among the herd - that it helps their orderly conduct as nothing else could. The crude human animal is in-eradicably superstitious, and there is every biological reason why they should be. Take away his Christian god and saints, and he will worship something else..."
415,religion,There's a big difference between kneeling down and bending over.
416,religion,"The Savage interrupted him. ""But isn't it natural to feel there's a God?"" ""You might as well ask if it's natural to do up one's trousers with zippers,"" said the Controller sarcastically. ""You remind me of another of those old fellows called Bradley. He defined philosophy as the finding of bad reason for what one believes by instinct. As if one believed anything by instinct! One believes things because one has been conditioned to believe them. Finding bad reasons for what one believes for other bad reasons–that's philosophy. People believe in God because they've been conditioned to."
417,religion,"When people ask me if a god created the universe, I tell them that the question itself makes no sense. Time didn’t exist before the big bang, so there is no time for god to make the universe in. It’s like asking directions to the edge of the earth; The Earth is a sphere; it doesn’t have an edge; so looking for it is a futile exercise. We are each free to believe what we want, and it’s my view that the simplest explanation is; there is no god. No one created our universe,and no one directs our fate. This leads me to a profound realization; There is probably no heaven, and no afterlife either. We have this one life to appreciate the grand design of the universe, and for that I am extremely grateful."
418,religion,A preoccupation with the next world clearly shows an inability to cope credibly with this one.
419,religion,"To see and feel one's beloved naked for the first time is one of life's pure, irreducible epiphanies. If there is a true religion in the universe, it must include that truth of contact or be forever hollow. To make love to the one true person who deserves that love is one of the few absolute rewards of being a human being, balancing all of the pain, loss, awkwardness, loneliness, idiocy, compromise, and clumsiness that go with the human condition. To make love to the right person makes up for a lot of mistakes."
420,philosophy,Two things are infinite: the universe and human stupidity; and I'm not sure about the universe.
421,philosophy,Be the change that you wish to see in the world.
422,philosophy,"Without music, life would be a mistake."
423,philosophy,"The opposite of love is not hate, it's indifference. The opposite of art is not ugliness, it's indifference. The opposite of faith is not heresy, it's indifference. And the opposite of life is not death, it's indifference."
424,philosophy,Go to heaven for the climate and hell for the company.
425,philosophy,A day without laughter is a day wasted.
426,philosophy,Have you ever noticed how ‘What the hell’ is always the right decision to make?
427,philosophy,How wonderful it is that nobody need wait a single moment before starting to improve the world.
428,philosophy,"Never doubt that a small group of thoughtful, committed, citizens can change the world. Indeed, it is the only thing that ever has."
429,philosophy,You talk when you cease to be at peace with your thoughts.
430,philosophy,May you live every day of your life.
431,philosophy,Man is the only creature who refuses to be what he is.
432,philosophy,"We have to dare to be ourselves, however frightening or strange that self may prove to be."
433,philosophy,"One, remember to look up at the stars and not down at your feet. Two, never give up work. Work gives you meaning and purpose and life is empty without it. Three, if you are lucky enough to find love, remember it is there and don't throw it away."
434,philosophy,"If a cluttered desk is a sign of a cluttered mind, of what, then, is an empty desk a sign?"
435,philosophy,"It is hard enough to remember my opinions, without also remembering my reasons for them!"
436,philosophy,"There is nothing either good or bad, but thinking makes it so."
437,philosophy,Never let your sense of morals prevent you from doing what is right.
438,philosophy,"A human being is a part of the whole called by us universe, a part limited in time and space. He experiences himself, his thoughts and feeling as something separated from the rest, a kind of optical delusion of his consciousness. This delusion is a kind of prison for us, restricting us to our personal desires and to affection for a few persons nearest to us. Our task must be to free ourselves from this prison by widening our circle of compassion to embrace all living creatures and the whole of nature in its beauty."
439,philosophy,Wise men speak because they have something to say; fools because they have to say something.
440,philosophy,You do not write your life with words...You write it with actions. What you think is not important. It is only important what you do.
441,philosophy,"Simplicity, patience, compassion.These three are your greatest treasures.Simple in actions and thoughts, you return to the source of being.Patient with both friends and enemies,you accord with the way things are.Compassionate toward yourself,you reconcile all beings in the world."
442,philosophy,Trust yourself. You know more than you think you do.
443,philosophy,"Without deviation from the norm, progress is not possible."
444,philosophy,"Think left and think right and think low and think high. Oh, the thinks you can think up if only you try!"
445,philosophy,"There may be times when we are powerless to prevent injustice, but there must never be a time when we fail to protest."
446,philosophy,"Do not fear to be eccentric in opinion, for every opinion now accepted was once eccentric."
447,philosophy,"Fantasy is escapist, and that is its glory. If a soldier is imprisioned by the enemy, don't we consider it his duty to escape?. . .If we value the freedom of mind and soul, if we're partisans of liberty, then it's our plain duty to escape, and to take as many people with us as we can!"
448,philosophy,The most beautiful experience we can have is the mysterious. It is the fundamental emotion that stands at the cradle of true art and true science.
449,philosophy,"A woman has to live her life, or live to repent not having lived it."
450,philosophy,We are all atheists about most of the gods that humanity has ever believed in. Some of us just go one god further.
451,philosophy,"I was within and without, simultaneously enchanted and repelled by the inexhaustible variety of life."
452,philosophy,"You're not to be so blind with patriotism that you can't face reality. Wrong is wrong, no matter who does it or says it."
453,philosophy,"If you ever find yourself in the wrong story, leave."
454,philosophy,Time is an illusion. Lunchtime doubly so.
455,philosophy,The past has no power over the present moment.
456,philosophy,"When we are tired, we are attacked by ideas we conquered long ago."
457,philosophy,Maybe everyone can live beyond what they're capable of.
458,philosophy,"Let's think the unthinkable, let's do the undoable. Let us prepare to grapple with the ineffable itself, and see if we may not eff it after all."
459,philosophy,The reasonable man adapts himself to the world: the unreasonable one persists in trying to adapt the world to himself. Therefore all progress depends on the unreasonable man.
460,philosophy,A truth that's told with bad intentBeats all the lies you can invent.
461,philosophy,I cannot teach anybody anything. I can only make them think
462,philosophy,Those who know do not speak. Those who speak do not know.
463,philosophy,We are addicted to our thoughts. We cannot change anything if we cannot change our thinking.
464,philosophy,"Happiness can be found, even in the darkest of times, if one only remembers to turn on the light."
465,philosophy,The price good men pay for indifference to public affairs is to be ruled by evil men.
466,philosophy,You only live twice:Once when you are bornAnd once when you look death in the face
467,philosophy,"Heard melodies are sweet, but those unheard, are sweeter"
468,philosophy,A paranoid is someone who knows a little of what's going on. 
469,philosophy,"For me, I am driven by two main philosophies: know more today about the world than I knew yesterday and lessen the suffering of others. You'd be surprised how far that gets you."
470,philosophy,Science is not only compatible with spirituality; it is a profound source of spirituality.
471,philosophy,It is easy in the world to live after the world's opinion; it is easy in solitude to live after our own; but the great man is he who in the midst of the crowd keeps with perfect sweetness the independence of solitude.
472,philosophy,Music is ... A higher revelation than all Wisdom & Philosophy
473,philosophy,The easy confidence with which I know another man's religion is folly teaches me to suspect that my own is also.
474,philosophy,A concept is a brick. It can be used to build a courthouse of reason. Or it can be thrown through the window.
475,philosophy,"An intellectual? Yes. And never deny it. An intellectual is someone whose mind watches itself. I like this, because I am happy to be both halves, the watcher and the watched. ""Can they be brought together?"" This is a practical question. We must get down to it. ""I despise intelligence"" really means: ""I cannot bear my doubts."
476,philosophy,"Do not train a child to learn by force or harshness; but direct them to it by what amuses their minds, so that you may be better able to discover with accuracy the peculiar bent of the genius of each."
477,philosophy,"Like all magnificent things, it's very simple."
