,emotion,quotes
0,love,"I'm selfish, impatient and a little insecure. I make mistakes, I am out of control and at times hard to handle. But if you can't handle me at my worst, then you sure as hell don't deserve me at my best."
1,love,"You've gotta dance like there's nobody watching,Love like you'll never be hurt,Sing like there's nobody listening,And live like it's heaven on earth."
2,love,You know you're in love when you can't fall asleep because reality is finally better than your dreams.
3,love,A friend is someone who knows all about you and still loves you.
4,love,Darkness cannot drive out darkness: only light can do that. Hate cannot drive out hate: only love can do that.
5,love,We accept the love we think we deserve.
6,love,It is better to be hated for what you are than to be loved for what you are not.
7,love,"Only once in your life, I truly believe, you find someone who can completely turn your world around. You tell them things that you’ve never shared with another soul and they absorb everything you say and actually want to hear more. You share hopes for the future, dreams that will never come true, goals that were never achieved and the many disappointments life has thrown at you. When something wonderful happens, you can’t wait to tell them about it, knowing they will share in your excitement. They are not embarrassed to cry with you when you are hurting or laugh with you when you make a fool of yourself. Never do they hurt your feelings or make you feel like you are not good enough, but rather they build you up and show you the things about yourself that make you special and even beautiful. There is never any pressure, jealousy or competition but only a quiet calmness when they are around. You can be yourself and not worry about what they will think of you because they love you for who you are. The things that seem insignificant to most people such as a note, song or walk become invaluable treasures kept safe in your heart to cherish forever. Memories of your childhood come back and are so clear and vivid it’s like being young again. Colours seem brighter and more brilliant. Laughter seems part of daily life where before it was infrequent or didn’t exist at all. A phone call or two during the day helps to get you through a long day’s work and always brings a smile to your face. In their presence, there’s no need for continuous conversation, but you find you’re quite content in just having them nearby. Things that never interested you before become fascinating because you know they are important to this person who is so special to you. You think of this person on every occasion and in everything you do. Simple things bring them to mind like a pale blue sky, gentle wind or even a storm cloud on the horizon. You open your heart knowing that there’s a chance it may be broken one day and in opening your heart, you experience a love and joy that you never dreamed possible. You find that being vulnerable is the only way to allow your heart to feel true pleasure that’s so real it scares you. You find strength in knowing you have a true friend and possibly a soul mate who will remain loyal to the end. Life seems completely different, exciting and worthwhile. Your only hope and security is in knowing that they are a part of your life."
8,love,"As he read, I fell in love the way you fall asleep: slowly, and then all at once."
9,love,"The opposite of love is not hate, it's indifference. The opposite of art is not ugliness, it's indifference. The opposite of faith is not heresy, it's indifference. And the opposite of life is not death, it's indifference."
10,love,"It is not a lack of love, but a lack of friendship that makes unhappy marriages."
11,love,"I love you without knowing how, or when, or from where. I love you simply, without problems or pride: I love you in this way because I do not know any other way of loving but this, in which there is no I or you, so intimate that your hand upon my chest is my hand, so intimate that when I fall asleep your eyes close."
12,love,"Love all, trust a few, do wrong to none."
13,love,Have you ever been in love? Horrible isn't it? It makes you so vulnerable. It opens your chest and it opens up your heart and it means that someone can get inside you and mess you up.
14,love,"Being deeply loved by someone gives you strength, while loving someone deeply gives you courage."
15,love,"This life is what you make it. No matter what, you're going to mess up sometimes, it's a universal truth. But the good part is you get to decide how you're going to mess it up. Girls will be your friends - they'll act like it anyway. But just remember, some come, some go. The ones that stay with you through everything - they're your true best friends. Don't let go of them. Also remember, sisters make the best friends in the world. As for lovers, well, they'll come and go too. And baby, I hate to say it, most of them - actually pretty much all of them are going to break your heart, but you can't give up because if you give up, you'll never find your soulmate. You'll never find that half who makes you whole and that goes for everything. Just because you fail once, doesn't mean you're gonna fail at everything. Keep trying, hold on, and always, always, always believe in yourself, because if you don't, then who will, sweetie? So keep your head high, keep your chin up, and most importantly, keep smiling, because life's a beautiful thing and there's so much to smile about."
16,love,"There is never a time or place for true love. It happens accidentally, in a heartbeat, in a single flashing, throbbing moment."
17,love,Love is that condition in which the happiness of another person is essential to your own.
18,love,"You may not be her first, her last, or her only. She loved before she may love again. But if she loves you now, what else matters? She's not perfect—you aren't either, and the two of you may never be perfect together but if she can make you laugh, cause you to think twice, and admit to being human and making mistakes, hold onto her and give her the most you can. She may not be thinking about you every second of the day, but she will give you a part of her that she knows you can break—her heart. So don't hurt her, don't change her, don't analyze and don't expect more than she can give. Smile when she makes you happy, let her know when she makes you mad, and miss her when she's not there."
19,love,"You love me. Real or not real?""I tell him, ""Real."
20,love,"I'm in love with you,"" he said quietly.""Augustus,"" I said.""I am,"" he said. He was staring at me, and I could see the corners of his eyes crinkling. ""I'm in love with you, and I'm not in the business of denying myself the simple pleasure of saying true things. I'm in love with you, and I know that love is just a shout into the void, and that oblivion is inevitable, and that we're all doomed and that there will come a day when all our labor has been returned to dust, and I know the sun will swallow the only earth we'll ever have, and I am in love with you."
21,love,"I am nothing special, of this I am sure. I am a common man with common thoughts and I've led a common life. There are no monuments dedicated to me and my name will soon be forgotten, but I've loved another with all my heart and soul, and to me, this has always been enough.."
22,love,"Love looks not with the eyes, but with the mind,And therefore is winged Cupid painted blind."
23,love,"Love is like the wind, you can't see it but you can feel it."
24,love,"People think a soul mate is your perfect fit, and that's what everyone wants. But a true soul mate is a mirror, the person who shows you everything that is holding you back, the person who brings you to your own attention so you can change your life. A true soul mate is probably the most important person you'll ever meet, because they tear down your walls and smack you awake. But to live with a soul mate forever? Nah. Too painful. Soul mates, they come into your life just to reveal another layer of yourself to you, and then leave. A soul mates purpose is to shake you up, tear apart your ego a little bit, show you your obstacles and addictions, break your heart open so new light can get in, make you so desperate and out of control that you have to transform your life, then introduce you to your spiritual master..."
25,love,"You don't love someone because they're perfect, you love them in spite of the fact that they're not."
26,love,"There is nothing I would not do for those who are really my friends. I have no notion of loving people by halves, it is not my nature."
27,love,"If you can make a woman laugh, you can make her do anything."
28,love,"We’re all a little weird. And life is a little weird. And when we find someone whose weirdness is compatible with ours, we join up with them and fall into mutually satisfying weirdness—and call it love—true love."
29,love,"Love never dies a natural death. It dies because we don't know how to replenish its source. It dies of blindness and errors and betrayals. It dies of illness and wounds; it dies of weariness, of witherings, of tarnishings."
30,love,If I had a flower for every time I thought of you...I could walk through my garden forever.
31,love,The real lover is the man who can thrill you by kissing your forehead or smiling into your eyes or just staring into space.
32,love,"To love at all is to be vulnerable. Love anything and your heart will be wrung and possibly broken. If you want to make sure of keeping it intact you must give it to no one, not even an animal. Wrap it carefully round with hobbies and little luxuries; avoid all entanglements. Lock it up safe in the casket or coffin of your selfishness. But in that casket, safe, dark, motionless, airless, it will change. It will not be broken; it will become unbreakable, impenetrable, irredeemable. To love is to be vulnerable."
33,love,"Dumbledore watched her fly away, and as her silvery glow faded he turned back to Snape, and his eyes were full of tears.""After all this time?""""Always,"" said Snape."
34,love,"When someone loves you, the way they talk about you is different. You feel safe and comfortable."
35,love,I've been making a list of the things they don't teach you at school. They don't teach you how to love somebody. They don't teach you how to be famous. They don't teach you how to be rich or how to be poor. They don't teach you how to walk away from someone you don't love any longer. They don't teach you how to know what's going on in someone else's mind. They don't teach you what to say to someone who's dying. They don't teach you anything worth knowing.
36,love,To die will be an awfully big adventure.
37,love,"A lady's imagination is very rapid; it jumps from admiration to love, from love to matrimony in a moment."
38,love,"So it's not gonna be easy. It's going to be really hard; we're gonna have to work at this everyday, but I want to do that because I want you. I want all of you, forever, everyday. You and me... everyday."
39,love,"Just when you think it can't get any worse, it can. And just when you think it can't get any better, it can."
40,love,Tis better to have loved and lostThan never to have loved at all.
41,love,"I love you as certain dark things are to be loved, in secret, between the shadow and the soul."
42,love,"He’s not perfect. You aren’t either, and the two of you will never be perfect. But if he can make you laugh at least once, causes you to think twice, and if he admits to being human and making mistakes, hold onto him and give him the most you can. He isn’t going to quote poetry, he’s not thinking about you every moment, but he will give you a part of him that he knows you could break. Don’t hurt him, don’t change him, and don’t expect for more than he can give. Don’t analyze. Smile when he makes you happy, yell when he makes you mad, and miss him when he’s not there. Love hard when there is love to be had. Because perfect guys don’t exist, but there’s always one guy that is perfect for you."
43,love,"The one you love and the one who loves you are never, ever the same person."
44,love,"When we love, we always strive to become better than we are. When we strive to become better than we are, everything around us becomes better too."
45,love,"I no longer believed in the idea of soul mates, or love at first sight. But I was beginning to believe that a very few times in your life, if you were lucky, you might meet someone who was exactly right for you. Not because he was perfect, or because you were, but because your combined flaws were arranged in a way that allowed two separate beings to hinge together."
46,love,One is loved because one is loved. No reason is needed for loving.
47,love,"When I despair, I remember that all through history the way of truth and love have always won. There have been tyrants and murderers, and for a time, they can seem invincible, but in the end, they always fall. Think of it--always."
48,love,Love is needing someone. Love is putting up with someone's bad qualities because they somehow complete you.
49,love,We love the things we love for what they are.
50,love,In vain have I struggled. It will not do. My feelings will not be repressed. You must allow me to tell you how ardently I admire and love you.
51,love,"Love is patient, love is kind. It does not envy, it does not boast, it is not proud. It is not rude, it is not self-seeking, it is not easily angered, it keeps no record of wrongs. Love does not delight in evil but rejoices with the truth. It always protects, always trusts, always hopes, always perseveres."
52,love,"Perhaps all the dragons in our lives are princesses who are only waiting to see us act, just once, with beauty and courage. Perhaps everything that frightens us is, in its deepest essence, something helpless that wants our love."
53,love,I would die for you. But I won't live for you.
54,love,"So, I love you because the entire universe conspired to help me find you."
55,love,Never love anyone who treats you like you're ordinary.
56,love,"I carry your heart with me (I carry it in my heart)I am never without it (anywhereI go you go,my dear; and whatever is done by only me is your doing,my darling)I fear no fate (for you are my fate,my sweet)I want no world (for beautiful you are my world,my true)and it's you are whatever a moon has always meant and whatever a sun will always sing is youhere is the deepest secret nobody knows(here is the root of the root and the bud of the bud and the sky of the sky of a tree called life; which growshigher than the soul can hope or mind can hide)and this is the wonder that's keeping the stars apartI carry your heart (I carry it in my heart)"
57,love,The only thing worse than a boy who hates you: a boy that loves you.
58,love,"You are, and always have been, my dream."
59,love,"You are my best friend as well as my lover, and I do not know which side of you I enjoy the most. I treasure each side, just as I have treasured our life together."
60,love,"And now I’m looking at you,” he said, “and you’re asking me if I still want you, as if I could stop loving you. As if I would want to give up the thing that makes me stronger than anything else ever has. I never dared give much of myself to anyone before – bits of myself to the Lightwoods, to Isabelle and Alec, but it took years to do it – but, Clary, since the first time I saw you, I have belonged to you completely. I still do. If you want me."
61,love,I would always rather be happy than dignified.
62,love,"Promise YourselfTo be so strong that nothingcan disturb your peace of mind.To talk health, happiness, and prosperityto every person you meet.To make all your friends feelthat there is something in themTo look at the sunny side of everythingand make your optimism come true.To think only the best, to work only for the best,and to expect only the best.To be just as enthusiastic about the success of othersas you are about your own.To forget the mistakes of the pastand press on to the greater achievements of the future.To wear a cheerful countenance at all timesand give every living creature you meet a smile.To give so much time to the improvement of yourselfthat you have no time to criticize others.To be too large for worry, too noble for anger, too strong for fear,and too happy to permit the presence of trouble.To think well of yourself and to proclaim this fact to the world,not in loud words but great deeds.To live in faith that the whole world is on your sideso long as you are true to the best that is in you."
63,love,"He's more myself than I am. Whatever our souls are made of, his and mine are the same."
64,love,Where there is love there is life.
65,love,"I think you still love me, but we can’t escape the fact that I’m not enough for you. I knew this was going to happen. So I’m not blaming you for falling in love with another woman. I’m not angry, either. I should be, but I’m not. I just feel pain. A lot of pain. I thought I could imagine how much this would hurt, but I was wrong."
66,love,"Some women choose to follow men, and some women choose to follow their dreams. If you're wondering which way to go, remember that your career will never wake up and tell you that it doesn't love you anymore."
67,love,"Above all, don't lie to yourself. The man who lies to himself and listens to his own lie comes to a point that he cannot distinguish the truth within him, or around him, and so loses all respect for himself and for others. And having no respect he ceases to love."
68,love,"Nobody has ever measured, not even poets, how much the heart can hold."
69,love,"The best love is the kind that awakens the soul and makes us reach for more, that plants a fire in our hearts and brings peace to our minds. And that's what you've given me. That's what I'd hoped to give you forever"
70,love,"Once upon a time there was a boy who loved a girl, and her laughter was a question he wanted to spend his whole life answering."
71,love,"Every heart sings a song, incomplete, until another heart whispers back. Those who wish to sing always find a song. At the touch of a lover, everyone becomes a poet."
72,love,"There are two basic motivating forces: fear and love. When we are afraid, we pull back from life. When we are in love, we open to all that life has to offer with passion, excitement, and acceptance. We need to learn to love ourselves first, in all our glory and our imperfections. If we cannot love ourselves, we cannot fully open to our ability to love others or our potential to create. Evolution and all hopes for a better world rest in the fearlessness and open-hearted vision of people who embrace life."
73,love,Doubt thou the stars are fire;Doubt that the sun doth move;Doubt truth to be a liar;But never doubt I love.
74,love,"We fell in love, despite our differences, and once we did, something rare and beautiful was created. For me, love like that has only happened once, and that's why every minute we spent together has been seared in my memory. I'll never forget a single moment of it."
75,love,We loved with a love that was more than love.
76,love,"This is a good sign, having a broken heart. It means we have tried for something."
77,love,"Eleanor was right. She never looked nice. She looked like art, and art wasn't supposed to look nice; it was supposed to make you feel something."
78,love,Out beyond ideas of wrongdoing and rightdoing there is a field.I'll meet you there.When the soul lies down in that grassthe world is too full to talk about.
79,love,"And so the lion fell in love with the lamb…"" he murmured. I looked away, hiding my eyes as I thrilled to the word.""What a stupid lamb,"" I sighed.""What a sick, masochistic lion."
80,love,"I heard what you said. I’m not the silly romantic you think. I don’t want the heavens or the shooting stars. I don’t want gemstones or gold. I have those things already. I want…a steady hand. A kind soul. I want to fall asleep, and wake, knowing my heart is safe. I want to love, and be loved."
81,love,"A guy and a girl can be just friends, but at one point or another, they will fall for each other...Maybe temporarily, maybe at the wrong time, maybe too late, or maybe forever"
82,love,"The more I know of the world, the more I am convinced that I shall never see a man whom I can really love. I require so much!"
83,love,I have decided to stick to love...Hate is too great a burden to bear.
84,love,"We live and breathe words. .... It was books that made me feel that perhaps I was not completely alone. They could be honest with me, and I with them. Reading your words, what you wrote, how you were lonely sometimes and afraid, but always brave; the way you saw the world, its colors and textures and sounds, I felt--I felt the way you thought, hoped, felt, dreamt. I felt I was dreaming and thinking and feeling with you. I dreamed what you dreamed, wanted what you wanted--and then I realized that truly I just wanted you."
85,love,What's meant to be will always find a way
86,love,"They say a person needs just three things to be truly happy in this world: someone to love, something to do, and something to hope for."
87,love,Hearts are made to be broken.
88,love,"Two people in love, alone, isolated from the world, that's beautiful."
89,love,"I have a history of making decisions very quickly about men. I have always fallen in love fast and without measuring risks. I have a tendency not only to see the best in everyone, but to assume that everyone is emotionally capable of reaching his highest potential. I have fallen in love more times than I care to count with the highest potential of a man, rather than with the man himself, and I have hung on to the relationship for a long time (sometimes far too long) waiting for the man to ascend to his own greatness. Many times in romance I have been a victim of my own optimism."
90,love,"The world is indeed full of peril, and in it there are many dark places; but still there is much that is fair, and though in all lands love is now mingled with grief, it grows perhaps the greater."
91,love,"This above all: to thine own self be true, And it must follow, as the night the day, Thou canst not then be false to any man."
92,love,"No relationship is perfect, ever. There are always some ways you have to bend, to compromise, to give something up in order to gain something greater...The love we have for each other is bigger than these small differences. And that's the key. It's like a big pie chart, and the love in a relationship has to be the biggest piece. Love can make up for a lot."
93,love,"Love is always patient and kind. It is never jealous. Love is never boastful or conceited. It is never rude or selfish. It does not take offense and is not resentful. Love takes no pleasure in other people’s sins, but delights in the truth. It is always ready to excuse, to trust, to hope, and to endure whatever comes."
94,love,"For the two of us, home isn't a place. It is a person. And we are finally home."
95,love,"Have you ever been in love? Horrible isn't it? It makes you so vulnerable. It opens your chest and it opens up your heart and it means that someone can get inside you and mess you up. You build up all these defenses, you build up a whole suit of armor, so that nothing can hurt you, then one stupid person, no different from any other stupid person, wanders into your stupid life...You give them a piece of you. They didn't ask for it. They did something dumb one day, like kiss you or smile at you, and then your life isn't your own anymore. Love takes hostages. It gets inside you. It eats you out and leaves you crying in the darkness, so simple a phrase like 'maybe we should be just friends' turns into a glass splinter working its way into your heart. It hurts. Not just in the imagination. Not just in the mind. It's a soul-hurt, a real gets-inside-you-and-rips-you-apart pain. I hate love."
96,love,"They didn’t agree on much. In fact, they didn’t agree on anything. They fought all the time and challenged each other ever day. But despite their differences, they had one important thing in common. They were crazy about each other."
97,love,"Love is so short, forgetting is so long."
98,love,"You could have had anything else in the world, and you asked for me.""She smiled up at him. Filthy as he was, covered in blood and dirt, he was the most beautiful thing she'd ever seen.""But I don't want anything else in the world."
99,love,"I think if I've learned anything about friendship, it's to hang in, stay connected, fight for them, and let them fight for you. Don't walk away, don't be distracted, don't be too busy or tired, don't take them for granted. Friends are part of the glue that holds life and faith together. Powerful stuff."
100,love,The very essence of romance is uncertainty.
101,love,"If all else perished, and he remained, I should still continue to be; and if all else remained, and he were annihilated, the universe would turn to a mighty stranger."
102,love,There is always some madness in love. But there is also always some reason in madness.
103,love,"If you remember me, then I don't care if everyone else forgets."
104,love,"To douchebags!"" he said, gesturing to Brad. ""And to girls that break your heart,"" he bowed his head to me. His eyes lost focus. ""And to the absolute fucking horror of losing your best friend because you were stupid enough to fall in love with her."
105,love,"Man may have discovered fire, but women discovered how to play with it."
106,love,"What I want is to be needed. What I need is to be indispensable to somebody. Who I need is somebody that will eat up all my free time, my ego, my attention. Somebody addicted to me. A mutual addiction."
107,love,"Love doesn't just sit there, like a stone, it has to be made, like bread; remade all the time, made new."
